[
  {
    "id": "google-2026-10-23-ads-begin-appearing-in-ai-mode-ending-its-ad-free-introduction",
    "company": "Google",
    "parent_group": "",
    "promoter_type": "Big tech",
    "activity_type": "Pricing & positioning",
    "channel": "Owned newsroom / blog",
    "audience": "Consumer",
    "country": "United States",
    "region": "Global",
    "subject": "AI Mode in Search",
    "title": "Ads begin appearing in AI Mode, ending its ad-free introduction",
    "description": "Google, the search and cloud business of Alphabet, began testing advertising inside AI Mode for users who connect their Google apps, ending the feature's ad-free introductory period. The pattern matches OpenAI's the same month: launch the AI surface clean, build the habit, then introduce advertising once leaving is inconvenient. No formats, pricing or advertiser numbers were published, and the test is limited to connected-app users.",
    "angle": "The free period was always an introduction, not a promise. Starting with connected-app users means the first ads land where Google knows most about intent, which is where they are least likely to feel random.",
    "craft_note": "No announcement campaign and no format reveal — the change surfaced as a test rather than a launch. Introducing advertising quietly avoids giving the decision a moment that critics can point at.",
    "asset_url": "",
    "spend": "",
    "agency": "",
    "outcome": "Not disclosed. No ad formats, pricing, advertiser count or performance data accompanied the test.",
    "metric": "",
    "digest_line": "Google began testing ads inside AI Mode for users who connect their Google apps, ending the feature's ad-free introductory period",
    "title_ru": "В AI Mode появилась реклама, завершив период работы без неё",
    "description_ru": "Google — поисковый и облачный бизнес Alphabet, начал тестировать рекламу внутри AI Mode для пользователей, подключивших свои приложения Google, завершив период работы функции без рекламы. Схема совпадает с тем, что в том же месяце сделала OpenAI: запустить AI-поверхность чистой, сформировать привычку и ввести рекламу тогда, когда уходить уже неудобно. Форматы, цены и число рекламодателей не публиковались, тест ограничен пользователями с подключёнными приложениями.",
    "angle_ru": "Бесплатный период всегда был введением, а не обещанием. Старт с пользователей подключённых приложений означает, что первая реклама появляется там, где Google лучше всего понимает намерение, и где она меньше всего выглядит случайной.",
    "outcome_ru": "Не раскрыто. Ни форматов, ни цен, ни числа рекламодателей, ни данных об эффективности вместе с тестом не приводилось.",
    "digest_line_ru": "Google начал тестировать рекламу в AI Mode для пользователей с подключёнными приложениями Google, завершив период работы без рекламы",
    "event_date": "2026-10-23",
    "source_name": "MarketingProfs AI Update",
    "source_url": "https://www.marketingprofs.com/opinions/2026/56255/ai-update-october-23-2026-ai-news-and-views-from-the-past-week",
    "source_tier": "secondary",
    "source_channel": "trade press",
    "confidence": "low",
    "added_at": "2026-10-26T18:00:00+00:00"
  },
  {
    "id": "anthropic-2026-10-23-claude-haiku-5-5-positioned-on-price-with-a-published-per-token-floor",
    "company": "Anthropic",
    "parent_group": "",
    "promoter_type": "AI lab",
    "activity_type": "Pricing & positioning",
    "channel": "Owned newsroom / blog",
    "audience": "Developer",
    "country": "United States",
    "region": "Global",
    "subject": "Claude Haiku 5.5",
    "title": "Claude Haiku 5.5 positioned on price, with a published per-token floor",
    "description": "Anthropic, the US lab behind Claude, led the Claude Haiku 5.5 launch with price, publishing a floor of $0.10 per million input tokens and $0.50 per million output tokens. The same period saw Claude Duet pitched quite differently, as a proactive assistant that watches connected applications and acts without being asked each time.",
    "angle": "Price as the headline claim for the small model, capability as the headline for the large one — the portfolio is segmented by argument, not just by size.",
    "craft_note": "A published per-token floor is a commitment a rival can undercut on a single page, which is the point: it makes the comparison trivial for a developer to run and hard for a competitor to fudge.",
    "asset_url": "",
    "spend": "",
    "agency": "",
    "outcome": "Not disclosed. No adoption, traffic or sign-up figure was reported alongside the pricing.",
    "metric": "$0.10 / $0.50 per million tokens",
    "digest_line": "Anthropic led the Claude Haiku 5.5 launch with price, publishing a $0.10 input and $0.50 output per-million-token floor for small requests",
    "title_ru": "Claude Haiku 5.5 продвигают через цену, публикуя нижнюю планку за токены",
    "description_ru": "Anthropic — американская лаборатория, создатель Claude, вывела в заголовок запуска Claude Haiku 5.5 цену, опубликовав планку $0,10 за миллион входных и $0,50 за миллион выходных токенов. Запуск Haiku 5.5 компания начала не с возможностей, а с цифры: запросы до 100 000 токенов по $0,10 за миллион входных токенов и $0,50 за миллион выходных. В тот же период Claude Duet позиционировался иначе — как проактивный ассистент, который следит за подключёнными приложениями и действует без отдельной команды.",
    "angle_ru": "Для младшей модели главный аргумент — цена, для старшей — возможности: линейка сегментирована не только по размеру, но и по типу аргумента.",
    "outcome_ru": "Не раскрыто. Данных о внедрении или регистрациях вместе с ценами не публиковалось.",
    "digest_line_ru": "Anthropic вывела в заголовок запуска Claude Haiku 5.5 цену: $0,10 за миллион входных и $0,50 за миллион выходных токенов",
    "event_date": "2026-10-23",
    "source_name": "MarketingProfs AI Update",
    "source_url": "https://www.marketingprofs.com/opinions/2026/56255/ai-update-october-23-2026-ai-news-and-views-from-the-past-week",
    "source_tier": "secondary",
    "source_channel": "trade press",
    "confidence": "low",
    "added_at": "2026-10-26T13:25:00+00:00"
  },
  {
    "id": "openai-2026-10-21-chatgpt-ads-expand-to-26-more-countries-reaching-89-markets",
    "company": "OpenAI",
    "parent_group": "",
    "promoter_type": "AI lab",
    "activity_type": "Pricing & positioning",
    "channel": "Owned newsroom / blog",
    "audience": "Enterprise buyer",
    "country": "United States",
    "region": "Global",
    "subject": "ChatGPT Ads",
    "title": "ChatGPT ads expand to 26 more countries, reaching 89 markets",
    "description": "OpenAI, the US lab behind ChatGPT, expanded ChatGPT advertising to 26 more countries, reaching 89 markets. Advertising inside ChatGPT reached 89 markets, adding 14 Latin American countries after Mexico and Brazil, plus Nigeria, South Africa, Serbia, Ukraine, Cambodia, Bangladesh and Pakistan among those named. Ads appear only on the Free and Go tiers; Plus, Pro and Enterprise stay ad-free. Reuters framed the expansion as building the ads business ahead of a potential IPO.",
    "angle": "Paying is how you opt out. Keeping Plus, Pro and Enterprise ad-free turns the subscription into the premium product and advertising into the price of the free tier — the same bargain the consumer web settled on, arriving in AI assistants.",
    "craft_note": "The sequencing does the work: the company said in August the ads business was at a $1bn annualised run rate, then widened the map. Announcing scale first and reach second lets the expansion read as demand rather than as a search for revenue.",
    "asset_url": "",
    "spend": "",
    "agency": "",
    "outcome": "More than 100,000 advertisers have run campaigns on the platform, and OpenAI said in August the ads business had reached a $1bn annualised revenue run rate. One outlet reported the market total as 80 rather than 89, which conflicts with the other sources.",
    "metric": "89 markets, 100,000+ advertisers",
    "digest_line": "OpenAI expanded ChatGPT ads to 26 more countries, reaching 89 markets, with ads confined to the Free and Go tiers",
    "title_ru": "Реклама в ChatGPT расширилась ещё на 26 стран и охватила 89 рынков",
    "description_ru": "OpenAI — американская лаборатория, создатель ChatGPT, расширила рекламу в ChatGPT ещё на 26 стран, доведя охват до 89 рынков. Реклама внутри ChatGPT доступна на 89 рынках: после Мексики и Бразилии добавились 14 стран Латинской Америки, а также Нигерия, ЮАР, Сербия, Украина, Камбоджа, Бангладеш и Пакистан. Реклама показывается только на тарифах Free и Go; Plus, Pro и Enterprise остаются без неё. Reuters связывает расширение с подготовкой рекламного бизнеса к возможному IPO.",
    "angle_ru": "Платёж — это способ отказаться от рекламы. Сохраняя Plus, Pro и Enterprise без рекламы, компания превращает подписку в премиальный продукт, а рекламу — в цену бесплатного тарифа.",
    "outcome_ru": "Более 100 000 рекламодателей уже запускали кампании, а в августе OpenAI сообщала о годовом рекламном раннрейте в $1 млрд. Одно издание указало 80 рынков вместо 89, что противоречит остальным источникам.",
    "digest_line_ru": "OpenAI расширила рекламу в ChatGPT ещё на 26 стран до 89 рынков, оставив её только на тарифах Free и Go",
    "event_date": "2026-10-21",
    "source_name": "Reuters (via The Star)",
    "source_url": "https://www.thestar.com.my/tech/tech-news/2026/10/21/openai-expands-chatgpt-ads-to-26-more-countries-in-bid-to-boost-revenue",
    "source_tier": "news",
    "source_channel": "trade press",
    "confidence": "high",
    "added_at": "2026-10-26T14:30:00+00:00"
  },
  {
    "id": "stagwell-2026-10-20-agentic-products-pulled-under-one-masterbrand-backed-by-a-multimillion",
    "company": "Stagwell",
    "parent_group": "",
    "promoter_type": "Agency / studio",
    "activity_type": "Brand & identity",
    "channel": "Multi-channel",
    "audience": "Enterprise buyer",